{
  "created_at": "2017-07-21T03:16:36.664Z",
  "created_by": "592f155746a1b867a114e010",
  "email": "demo_person@test.dendra.science",
  "full_name": "Demo Person - Updated",
  "is_enabled": true,
  "name": "Demo Person",
  "updated_at": "2017-07-21T03:16:36.664Z",
  "updated_by": "592f155746a1b867a114e010"
}